extras_10uid_bi_strs,extras_title_en_txts,extras_pkuniqueidcode_bi_strs,extras_statusf_en_strs,Load to OLC,extras_productidnew_bi_strs,
primary128011,Update on shifts in prairie crop production,article21-004-x19940002416_12,Do not load to OLC,Do not load to OLC,21-004-X19940002416,
primary128012,Imports of cut roses growing,article21-004-x19940002417_12,Do not load to OLC,Do not load to OLC,21-004-X19940002417,
primary128042,Pigs breed better on big farms,article21-004-x19970033232_12,Do not load to OLC,Do not load to OLC,21-004-X19970033232,
primary123691,The hours people work,article11-010-x19940091588_12,,Do not load to OLC,11-010-X19940091588,
primary123757,Measuring the age of retirement,article11-010-x19970073085_12,,Do not load to OLC,11-010-X19970073085,
primary129778,"Census Metropolitan Area, Census Agglomeration and Census Tract (CMA/CA/CT) Reference Maps, 1996 Census (Geography Products: Geographic Reference Products)",publication92-354-x_12,Ongoing/Available,Do not load to OLC,92-354-X,
primary129816,"Census Metropolitan Area, Census Agglomeration and Census Tract (CMA/CA/CT) Reference Maps, 1996 Census (Geography  Products: Geographic Reference Products)",publication92f0092x_12,Ongoing/Available,Do not load to OLC,92F0092X,
primary123804,Entertainment services: a growing consumer market,article11-010-x19990064599_12,,Do not load to OLC,11-010-X19990064599,
primary123834,Unemployment kaleidoscope,article11-010-x20000095185_12,,Do not load to OLC,11-010-X20000095185,
primary123857,Time lost due to industrial disputes,article11-010-x20010095892_12,,Do not load to OLC,11-010-X20010095892,
primary122156,"Revised Intercensal Population and Family Estimates, July 1, 1971-1991",publication91-537-x_12,Discontinued/Not available,Do not load to OLC,91-537-X,
primary128013,Farming - It's a risky business,article21-004-x19940002418_12,Do not load to OLC,Do not load to OLC,21-004-X19940002418,
primary130043,A National Overview - Population and Dwelling Counts (Data Products : 1996 Census of Population),cens_tbtp93-357-x_12,Discontinued/Not available,,93-357-X,
primary136259,"Postcensal Estimates of Families, Canada, Provinces and Territories",publication91-204-x_12,Discontinued/Not available,Do not load to OLC,91-204-X,
primary136691,"Postcensal Annual Estimates of Population for Census Divisions and Census Metropolitan Areas, June 1, ..., (Component Method)",publication91-212-x_12,Discontinued/Not available,Do not load to OLC,91-212-X,
primary136685,"Postcensal Annual Estimates of Population for Census Divisions and Census Metropolitan Areas, June 1, ..., (Regression Method)",publication91-211-x_12,Discontinued/Not available,Do not load to OLC,91-211-X,
primary124799,Valuation of Canada's agricultural land,article11-528-x19960013160_12,Do not load to OLC,Do not load to OLC,11-528-X19960013160,
primary123122,1986 Census highlights: Marital status,article11-008-x19870041362_12,,Do not load to OLC,11-008-X19870041362,
primary123115,1986 Census highlights: Aging of the Canadian population,article11-008-x19870031339_12,,Do not load to OLC,11-008-X19870031339,
primary122152,New Trends in the Family: Demographic Facts and Figures,publication91-535-x_12,Discontinued/Not available,Do not load to OLC,91-535-X,
primary128794,The Seniors Boom: Dramatic Increases in Longevity and Prospects for Better Health,publication89-515-x_12,Do not load to OLC,Do not load to OLC,89-515-X,
primary125187,1991 Census Monograph Series,publication96-321-m_12,Ongoing/Available,Do not load to OLC,96-321-M,
primary136650,Human resources in leisure and personal services industries,article63-233-x19940003064_12,,Do not load to OLC,63-233-X19940003064,
primary135012,Provincial Government Enterprise Finance,publication61-204-x_12,Discontinued/Not available,Do not load to OLC,61-204-X,
primary123862,The labour market in the week of September 11,article11-010-x20010115965_12,,Do not load to OLC,11-010-X20010115965,
primary124865,The labour market in the week of September 11,article75-001-x20011045985_12,,Do not load to OLC,75-001-X20011045985,
primary129144,1991 Aboriginal Peoples Survey Adults Microdata File - User's Guide,publication89m0013g_12,Discontinued/Not available,Do not load to OLC,89M0013G,
primary129854,Aboriginal Community Profiles: Complete Subscription Package - Prince Edward Island,publication89f0009x_12,Discontinued/Not available,Do not load to OLC,89F0009X,
primary128807,Canadian National Child Care Study: Parental Work Patterns and Child Care Needs,publication89-529-x_12,Ongoing/Available,Do not load to OLC,89-529-X,
primary128808,"Canadian National Child Care Study: Workplace Benefits and Flexibility, A Perspective on Parents' Experiences",publication89-530-x_12,Ongoing/Available,Do not load to OLC,89-530-X,
primary122342,Current Population Profile - Microdata User's Guide,publication91m0001g_12,Discontinued/Not available,Do not load to OLC,91M0001G,
primary128144,National Electronic Media Use Survey - Microdata User's Guide,publication87m0013g_12,Discontinued/Not available,Do not load to OLC,87M0013G,
primary128842,Veterans' Care Needs Survey,publication89-554-x_12,Discontinued/Not available,Do not load to OLC,89-554-X,
primary135417,Survey of Volunteer Workers (1980) - Microdata User's Guide,publication89m0010g_12,Discontinued/Not available,Do not load to OLC,89M0010G,
primary128814,"1-disability, 2-housing (The Aboriginal Peoples Survey 1991)",publication89-535-x_12,Discontinued/Not available,Do not load to OLC,89-535-X,
primary122142,A Portrait of Families in Canada,publication89-523-x_12,Ongoing/Available,Do not load to OLC,89-523-X,
primary133757,A Portrait of Children in Canada,publication89-520-x_12,Ongoing/Available,Do not load to OLC,89-520-X,
primary128823,A Profile of the Métis,publication89-547-x_12,Discontinued/Not available,Do not load to OLC,89-547-X,
primary126581,A Profile of Three Disabled Populations (1986 Health and Activity Limitation Survey),publication82f0003x_12,Discontinued/Not available,Do not load to OLC,82F0003X,
primary124283,"Using databases to design, generate and store business questionnaires at Statistics Canada",article11-522-x19970014180_12,,Do not load to OLC,11-522-X19970014180,
primary124300,Response analysis surveys: what are they and what can we gain from them? A case study using the Survey of Family Expenditures,article11-522-x19970014227_12,,Do not load to OLC,11-522-X19970014227,
primary124301,Interview and presence at home,article11-522-x19970014228_12,,Do not load to OLC,11-522-X19970014228,
primary124315,Reducing statistical burdens on business developments in the United Kingdom,article11-522-x19970014242_12,,Do not load to OLC,11-522-X19970014242,
primary124316,Survey integration: Collecting more data from fewer respondents,article11-522-x19970014243_12,,Do not load to OLC,11-522-X19970014243,
primary124314,Electronic data reporting,article11-522-x19970014241_12,,Do not load to OLC,11-522-X19970014241,
primary124313,Networked hand-held CASIC,article11-522-x19970014240_12,,Do not load to OLC,11-522-X19970014240,
primary124277,Data capture and coding for the 2001 GB Census,article11-522-x19970014174_12,,Do not load to OLC,11-522-X19970014174,
primary124288,A history of European business statistics,article11-522-x19970014185_12,,Do not load to OLC,11-522-X19970014185,
primary124353,"Combining census, survey, demographic and administrative data to produce a one number census",article11-522-x19990015638_12,,Do not load to OLC,11-522-X19990015638,
primary124332,A new longitudinal processing system for the Survey of Income and Program Participation,article11-522-x19980015021_12,,Do not load to OLC,11-522-X19980015021,
primary124351,Parameter estimation for a finite mixture of distributions for dichotomous longitudinal data: Comparing algorithms,article11-522-x19980015037_12,,Do not load to OLC,11-522-X19980015037,
primary124370,A comparison of two record linkage procedures,article11-522-x19990015664_12,,Do not load to OLC,11-522-X19990015664,
primary124388,Meta-analysis of population dynamics data: Hierarchical modelling to reduce uncertainty,article11-522-x19990015694_12,,Do not load to OLC,11-522-X19990015694,
primary124379,Dual system estimation and the 2001 Census coverage surveys of the U.K.,article11-522-x19990015682_12,,Do not load to OLC,11-522-X19990015682,
primary124328,Multilevel modeling of complex data structures with multiple unit membership and missing unit identifications,article11-522-x19980015018_12,,Do not load to OLC,11-522-X19980015018,
primary124364,Creation of an occupational surveillance system in Canada: Combining data for a unique Canadian study,article11-522-x19990015652_12,,Do not load to OLC,11-522-X19990015652,
primary124368,Overview of record linkage,article11-522-x19990015660_12,,Do not load to OLC,11-522-X19990015660,
primary124341,Marginal models for repeated observations: Inference with survey data,article11-522-x19980015029_12,,Do not load to OLC,11-522-X19980015029,
primary124292,"An integrated approach to survey development, processing and documentation",article11-522-x19970014207_12,,Do not load to OLC,11-522-X19970014207,
primary124331,Calculation of weights for the European panel of households: A comparison of some indicators based on variables selected to correct for homogenous categorical non-response,article11-522-x19980015020_12,,Do not load to OLC,11-522-X19980015020,
primary124380,Simultaneous calibration of several surveys,article11-522-x19990015684_12,,Do not load to OLC,11-522-X19990015684,
primary124378,Estimation using the generalized weight share method: The case of record linkage,article11-522-x19990015680_12,,Do not load to OLC,11-522-X19990015680,
primary124333,"Estimation of gross flows from complex surveys adjusting for missing data, classification errors and informative sampling",article11-522-x19980015022_12,,Do not load to OLC,11-522-X19980015022,
primary124257,A solution to the design and implementation of a fast-track survey: two-phase sampling,article11-522-x19970014150_12,,Do not load to OLC,11-522-X19970014150,
primary124339,Calculation of change for annual business surveys,article11-522-x19980015027_12,,Do not load to OLC,11-522-X19980015027,
primary124349,Estimation with partial overlap longitudinal samples,article11-522-x19980015035_12,,Do not load to OLC,11-522-X19980015035,
primary124199,Data integration: The view from the back of the bus,article11-522-x19950013243_12,,Do not load to OLC,11-522-X19950013243,
primary124181,Re-engineering the U.S. Current Population Survey,article11-522-x19940012619_12,,Do not load to OLC,11-522-X19940012619,
primary124172,Re-engineering the income security programs: Income security programs - Redesign project,article11-522-x19940012607_12,,Do not load to OLC,11-522-X19940012607,
primary124182,"Re-engineering the Survey of Employment, Payrolls and Hours",article11-522-x19940012620_12,,Do not load to OLC,11-522-X19940012620,
primary124174,The evolution of France's statistical system: A few points of note,article11-522-x19940012610_12,,Do not load to OLC,11-522-X19940012610,
primary124176,Towards a global statistical system,article11-522-x19940012612_12,,Do not load to OLC,11-522-X19940012612,
primary124173,Better service at lower cost: Is it re-engineering we are talking about?,article11-522-x19940012608_12,,Do not load to OLC,11-522-X19940012608,
primary124183,Re-engineering the statistical agency: A view from within,article11-522-x19940012622_12,,Do not load to OLC,11-522-X19940012622,
primary124222,Evolving partnerships in the information industry,article11-522-x19950013266_12,,Do not load to OLC,11-522-X19950013266,
primary124303,Dealing with non-response with a political component,article11-522-x19970014230_12,,Do not load to OLC,11-522-X19970014230,
primary124372,A donor imputation system to create a census database fully adjusted for underenumeration,article11-522-x19990015668_12,,Do not load to OLC,11-522-X19990015668,
primary124212,Using noise for disclosure limitations of establishment tabular data,article11-522-x19950013256_12,,Do not load to OLC,11-522-X19950013256,
primary124309,Sample design for the PRODCOM (Product Sales ) inquiry,article11-522-x19970014236_12,,Do not load to OLC,11-522-X19970014236,
primary124803,Electronic Publications Pilot 1996 - 1997: Final Report,issue11-534-x1997001_12,Completed,Do not load to OLC,11-534-X1997001,
primary124317,Integrating surveys,article11-522-x19970014244_12,,Do not load to OLC,11-522-X19970014244,
primary124373,Integrated media planning through statistical matching: Development and evaluation of the New Zealand panorama service,article11-522-x19990015670_12,,Do not load to OLC,11-522-X19990015670,
primary124377,Combining aggregated survey and administrative data to determine needs-based health care resource allocations to geographic areas in Ontario,article11-522-x19990015678_12,,Do not load to OLC,11-522-X19990015678,
primary124325,Recent development of software to analyse longitudinal studies: Examples from the Office for National Statistics Longitudinal Study,article11-522-x19980015015_12,,Do not load to OLC,11-522-X19980015015,
primary124369,"Creating and enhancing a population-based linked health database: methods, challenges, and applications",article11-522-x19990015662_12,,Do not load to OLC,11-522-X19990015662,
primary124344,The Long-term consequences of growing up with a single parent,article11-522-x19980015032_12,,Do not load to OLC,11-522-X19980015032,
primary124386,Using meta-analysis to understand the impact of time-of-use rates,article11-522-x19990015692_12,,Do not load to OLC,11-522-X19990015692,
primary124354,Statistical processing in the next millennium,article11-522-x19990015640_12,,Do not load to OLC,11-522-X19990015640,
primary124337,Tools for inference on dynamics of low income status,article11-522-x19980015025_12,,Do not load to OLC,11-522-X19980015025,
primary124248,Assessing nonsampling errors in survey data through random intercept models,article11-522-x19960013325_12,,Do not load to OLC,11-522-X19960013325,
primary124384,A method of generating a sample of artificial data from several existing tables: Application based on the residential electric power market,article11-522-x19990015690_12,,Do not load to OLC,11-522-X19990015690,
primary124374,Fusion of data and estimation by entropy maximization,article11-522-x19990015672_12,,Do not load to OLC,11-522-X19990015672,
primary124375,Spatial statistics and environmental epidemiology using routine data,article11-522-x19990015674_12,,Do not load to OLC,11-522-X19990015674,
primary124345,Probability of victimization over time: Results from the U.S. National Crime Victimization Survey,article11-522-x19980015033_12,,Do not load to OLC,11-522-X19980015033,
primary124366,Particulate matter and daily mortality: Combining time series information from eight U.S. cities,article11-522-x19990015656_12,,Do not load to OLC,11-522-X19990015656,
primary124338,Evaluating nonresponse adjustment in the Current Population Survey (CPS) using longitudinal data,article11-522-x19980015026_12,,Do not load to OLC,11-522-X19980015026,
primary124340,Variance estimation in longitudinal studies of income dynamics,article11-522-x19980015028_12,,Do not load to OLC,11-522-X19980015028,
primary124361,Modeling labour force careers for the lifepaths simulation model,article11-522-x19990015648_12,,Do not load to OLC,11-522-X19990015648,
primary124334,Mobility matrices and computation of associated precision,article11-522-x19980015023_12,,Do not load to OLC,11-522-X19980015023,
primary124273,Imputing for swiss cheese patterns of missing data,article11-522-x19970014170_12,,Do not load to OLC,11-522-X19970014170,
primary124171,Re-engineering at Northern Telecom - Lessons from the private sector,article11-522-x19940012606_12,,Do not load to OLC,11-522-X19940012606,
primary124192,The human resources perspective in the operational realignment at Statistics Canada,article11-522-x19940012634_12,,Do not load to OLC,11-522-X19940012634,
primary124191,Data management and the information warehouse: Infrastructure for re-engineering,article11-522-x19940012632_12,,Do not load to OLC,11-522-X19940012632,
primary124259,Statistical properties and quality of register-based census statistics in Finland,article11-522-x19970014152_12,,Do not load to OLC,11-522-X19970014152,
primary124190,The operational framework at Statistics Canada,article11-522-x19940012631_12,,Do not load to OLC,11-522-X19940012631,
primary124184,Re-engineering the Annual Survey of Manufactures,article11-522-x19940012623_12,,Do not load to OLC,11-522-X19940012623,
primary124185,Restructuring the U.S. Standard Industrial Classification systems: The development of NAICS,article11-522-x19940012624_12,,Do not load to OLC,11-522-X19940012624,
primary124234,Examining alternative methodologies developing communications strategies: Increasing response rates vs increasing non-response,article11-522-x19960013311_12,,Do not load to OLC,11-522-X19960013311,
primary124357,Combining administrative data with survey data: experience in the Australian survey of employment and unemployment patterns,article11-522-x19990015644_12,,Do not load to OLC,11-522-X19990015644,
primary124215,Seducing the gatekeepers: Statistics Canada's Daily and the news media,article11-522-x19950013259_12,,Do not load to OLC,11-522-X19950013259,
primary124233,Response rate and the Canadian Labour Force Survey: Luck or good planning?,article11-522-x19960013310_12,,Do not load to OLC,11-522-X19960013310,
primary124267,A Hierarchical Bayes analysis of census undercoverage,article11-522-x19970014160_12,,Do not load to OLC,11-522-X19970014160,
primary124326,Multilevel models for repeated binary outcomes: Attitudes and vote over the electoral cycle,article11-522-x19980015016_12,,Do not load to OLC,11-522-X19980015016,
primary124208,Taking uncertainty and error in censuses and surveys seriously,article11-522-x19950013252_12,,Do not load to OLC,11-522-X19950013252,
primary124229,Standards and guidelines for nonsampling error: Providing better services for less,article11-522-x19960013306_12,,Do not load to OLC,11-522-X19960013306,
primary124200,Meta-analysis of multiple cohorts of underground miners exposed to radon,article11-522-x19950013244_12,,Do not load to OLC,11-522-X19950013244,
primary124258,The workplace and employee survey: methodological challenges and pilot results,article11-522-x19970014151_12,,Do not load to OLC,11-522-X19970014151,
primary124322,Cycle 2 and beyond: Preparing and storing longitudinal data of the National Population Health Survey,article11-522-x19980015007_12,,Do not load to OLC,11-522-X19980015007,
primary124247,"Time-, respondent- and interviewer-related causes of item nonresponse on CES-D Deperession scale: A multilevel model",article11-522-x19960013324_12,,Do not load to OLC,11-522-X19960013324,
primary124216,New technologies for data collection and dissemination,article11-522-x19950013260_12,,Do not load to OLC,11-522-X19950013260,
primary124306,The GIS/MISdata model concept,article11-522-x19970014233_12,,Do not load to OLC,11-522-X19970014233,
primary124263,Developing a one number census in the United Kingdom,article11-522-x19970014156_12,,Do not load to OLC,11-522-X19970014156,
primary124242,The World Wide Web as a data collection methodology,article11-522-x19960013319_12,,Do not load to OLC,11-522-X19960013319,
primary124205,Informational privacy and data protection,article11-522-x19950013249_12,,Do not load to OLC,11-522-X19950013249,
primary124382,Combining data sources: Air pollution and asthma consultations in 59 general practices throughout England and Wales - A case study,article11-522-x19990015688_12,,Do not load to OLC,11-522-X19990015688,
primary124381,Diagnostics for comparison and combined use of diary and interview data from the U.S. consumer expenditure survey,article11-522-x19990015686_12,,Do not load to OLC,11-522-X19990015686,
primary124355,The challenges of using administrative data to support policy-relevant research: The example of the longitudinal immigration database (IMDB),article11-522-x19990015642_12,,Do not load to OLC,11-522-X19990015642,
primary124206,Population registers and protection of privacy: The experience of the Balsac Register since 1972,article11-522-x19950013250_12,,Do not load to OLC,11-522-X19950013250,
primary124367,Uncertainties in estimates of radon lung cancer risks,article11-522-x19990015658_12,,Do not load to OLC,11-522-X19990015658,
primary124217,"Data management for Canada's Health Intelligence Network: Building a virtual information warehouse through standards, cooperation and partnerships",article11-522-x19950013261_12,,Do not load to OLC,11-522-X19950013261,
primary124350,Multivariate logistic regression for data from complex surveys,article11-522-x19980015036_12,,Do not load to OLC,11-522-X19980015036,
primary124363,The U.S. manufacturing plant ownership change database: Research possibilities,article11-522-x19990015650_12,,Do not load to OLC,11-522-X19990015650,
primary124371,An evaluation of data fusion techniques,article11-522-x19990015666_12,,Do not load to OLC,11-522-X19990015666,
primary124336,A latent class model for the transition from school to working life in presence of missing data,article11-522-x19980015024_12,,Do not load to OLC,11-522-X19980015024,
primary124232,What is the role of demographic analysis in the 2000 United States Census?,article11-522-x19960013309_12,,Do not load to OLC,11-522-X19960013309,
primary124376,"Factors associated with nursing home entry for elders in Manitoba, Canada",article11-522-x19990015676_12,,Do not load to OLC,11-522-X19990015676,
primary124327,Random effects models for longitudinal data from complex samples,article11-522-x19980015017_12,,Do not load to OLC,11-522-X19980015017,
primary124347,An increment-decrement model of secondary school progression for Canadian provinces,article11-522-x19980015034_12,,Do not load to OLC,11-522-X19980015034,
primary124342,Estimating the incidence of dementia from longitudinal two-phase sampling with nonignorable missing data,article11-522-x19980015030_12,,Do not load to OLC,11-522-X19980015030,
primary124236,Minimising non-response in a panel survey,article11-522-x19960013313_12,,Do not load to OLC,11-522-X19960013313,
primary124269,Methodological documentation of CASIC surveys on the world wide web,article11-522-x19970014162_12,,Do not load to OLC,11-522-X19970014162,
primary124264,Statistical analyses of complex survey data using WesVarPC software,article11-522-x19970014157_12,,Do not load to OLC,11-522-X19970014157,
primary124343,Weighting and variance estimation for the exploration of possible time trends in data from the U.S. Third National Health and Nutrition Examination Survey,article11-522-x19980015031_12,,Do not load to OLC,11-522-X19980015031,
primary124302,A study of non-response on the UK Family Expenditure Survey,article11-522-x19970014229_12,,Do not load to OLC,11-522-X19970014229,
primary124282,An investigation into the possible use of multilevel models based on survey data to update census estimates for small areas,article11-522-x19970014179_12,,Do not load to OLC,11-522-X19970014179,
primary124239,Monitoring computer assisted telephone interviewing at the U.S. Bureau of the Census,article11-522-x19960013316_12,,Do not load to OLC,11-522-X19960013316,
primary124330,Weighting versus modeling in adjusting for non-response in the British Labour Force Survey: An application to gross flows estimation,article11-522-x19980015019_12,,Do not load to OLC,11-522-X19980015019,
primary124281,Nonresponse and coverage adjustments for a dual-frame survey,article11-522-x19970014178_12,,Do not load to OLC,11-522-X19970014178,
primary124203,"Development, use and modification of health risk appraisal functions: The Framingham Study",article11-522-x19950013247_12,,Do not load to OLC,11-522-X19950013247,
primary124311,A predictive dialer,article11-522-x19970014238_12,,Do not load to OLC,11-522-X19970014238,
primary124312,Call management and the use of CATI software by private survey firms,article11-522-x19970014239_12,,Do not load to OLC,11-522-X19970014239,
primary126221,Guide to the Income and Expenditure Accounts,issue13-603-m1990001_12,Completed,Do not load to OLC,13-603-M1990001,
primary129715,1991 Census Catalogue (Second Edition) (Reference Products: General Reference Products: 1991 Census of Population),cens_cphta92-302-x_12,Discontinued/Not available,,92-302-X,
primary129713,1991 Census Catalogue (First Edition) (General Reference Products: 1991 Census of Population),cens_cphta92-302-p_12,Discontinued/Not available,,92-302-P,
primary129712,1991 Census Dictionary (Reference Products: General Reference Products: 1991 Census of Population),cens_cphta92-301-x_12,Discontinued/Not available,,92-301-X,
primary129719,1991 Census Handbook (Reference Products: General Reference: 1991 Census of Population),cens_cphta92-305-x_12,Discontinued/Not available,,92-305-X,
primary129754,Home Language and Knowledge of Languages (Reference Products: Technical Reports: 1991 Census of Population),cens_cphta92-336-x_12,Discontinued/Not available,,92-336-X,
primary129760,Occupation According to the 1980 Standard Occupational Classification (Reference Products: Technical Reports: 1991 Census of Population),cens_cphta92-339-x_12,Discontinued/Not available,,92-339-X,
primary129756,Labour Force Activity (Reference Products: Technical Reports: 1991 Census of Population),cens_cphta92-337-x_12,Discontinued/Not available,,92-337-X,
primary129758,Industry (Reference Products: Technical Reports: 1991 Census of Population),cens_cphta92-338-x_12,Discontinued/Not available,,92-338-X,
primary125268,A computer algebra for sample survey theory,article12-001-x19970013100_12,,Do not load to OLC,12-001-X19970013100,
