extras_10uid_bi_strs,extras_title_en_txts,extras_pkuniqueidcode_bi_strs,extras_statusf_en_strs,Load to OLC,extras_productidnew_bi_strs,
primary130751,Profile of Census Tracts in Halifax - Part A (Area Profile Series: Data Products: 1991 Census of Population),cens_tbtp95-314-x_12,Discontinued/Not available,,95-314-X,
primary130749,Profile of Census Divisions and Subdivisions in Nova Scotia - Part B (Area Profile Series: Data Products: 1991 Census of Population),cens_tbtp95-313-x_12,Discontinued/Not available,,95-313-X,
primary130747,Profile of Census Divisions and Subdivisions in Nova Scotia - Part A (Area Profile Series: Data Products: 1991 Census of Population),cens_tbtp95-312-x_12,Discontinued/Not available,,95-312-X,
primary136271,Profile of Census Tracts in St.John's (Data Products: Area Profiles: 1996 Census of Population),cens_tbtp95-194-x_12,Discontinued/Not available,,95-194-X,
primary135358,Profile of Census Tracts in Hamilton - Part B  (Area Profile Series: Data Products: 1991 Census of Population),cens_tbtp95-342-x_12,Discontinued/Not available,,95-342-X,
primary136265,Newfoundland. Part 2,cens_tbtp94-102-x_12,Discontinued/Not available,,94-102-X,
primary136170,Newfoundland. Part 1,cens_tbtp94-101-x_12,Discontinued/Not available,,94-101-X,
primary135770,"Aboriginal People - Employment Equity Fact Sheets, 1986 Census",cens_tbtp89f0025x_12,Discontinued/Not available,,89F0025X,
primary128390,Profile of Census Tracts in Calgary - Part B (Area Profile Series: Data Products: 1991 Census of Population),cens_tbtp95-375-x_12,Discontinued/Not available,,95-375-X,
primary128392,Profile of Census Tracts in Edmonton - Part A (Area Profile Series: Data Products: 1991 Census of Population),cens_tbtp95-377-x_12,Discontinued/Not available,,95-377-X,
primary128387,Profile of Census Divisions and Subdivisions in Alberta - Part B (Area Profile Series: Data Products: 1991 Census of Population),cens_tbtp95-373-x_12,Discontinued/Not available,,95-373-X,
primary133681,Manitoba. Part 1,cens_tbtp94-113-x_12,Discontinued/Not available,,94-113-X,
primary130003,Mobility and Migration (Data Products: Nation Series: 1991 Census of Population),cens_tbtp93-322-x_12,Discontinued/Not available,,93-322-X,
primary130005,Place of Work (Data Products: Nation Series: 1991 Census of Population),cens_tbtp93-323-x_12,Discontinued/Not available,,93-323-X,
primary128828,Profile of Census Tracts in Regina and Saskatoon - Part A (Area Profile Series: Data Products: 1991 Census of Population),cens_tbtp95-367-x_12,Discontinued/Not available,,95-367-X,
primary130012,Occupation (Data Products: Nation Series: 1991 Census of Population),cens_tbtp93-327-x_12,Discontinued/Not available,,93-327-X,
primary130001,Fertility (Data Products: Nation Series: 1991 Census of Population),cens_tbtp93-321-x_12,Discontinued/Not available,,93-321-X,
primary129998,Religions in Canada (Data Products: Nation Series: 1991 Census of Population),cens_tbtp93-319-x_12,Discontinued/Not available,,93-319-X,
primary128287,"Profile of Census Tracts in North Bay, Sault Ste. Marie, Sudbury and Thunder Bay - Part B (Area Profile Series: Data Products: 1991 Census of Population)",cens_tbtp95-349-x_12,Discontinued/Not available,,95-349-X,
primary128278,"Profile of Census Tracts in London, Sarnia - Clearwater and Windsor - Part B (Area Profile Series: Data Products: 1991 Census of Population)",cens_tbtp95-347-x_12,Discontinued/Not available,,95-347-X,
primary128282,"Profile of Census Tracts in North Bay, Sault Ste. Marie, Sudbury and Thunday Bay - Part A (Area Profile Series: Data Products: 1991 Census of Population)",cens_tbtp95-348-x_12,Discontinued/Not available,,95-348-X,
primary128273,"Profile of Census Tracts in London, Sarnia - Clearwater and Windsor - Part A (Area Profile Series: Data Products: 1991 Census of Population)",cens_tbtp95-346-x_12,Discontinued/Not available,,95-346-X,
primary128234,Agricultural Profile of Quebec - Part 2 (Data Products: 1991 Census of Agriculture),cens_tbtp95-336-x_12,Discontinued/Not available,,95-336-X,
primary128226,Profile of Census Tracts in Québec - Part B  (Area Profile Series: Data Products: 1991 Census of Population),cens_tbtp95-333-x_12,Discontinued/Not available,,95-333-X,
primary128240,Profile of Census Divisions and Subdivisions in Ontario - Part B (Area Profile Series: Data Products: 1991 Census of Population),cens_tbtp95-338-x_12,Discontinued/Not available,,95-338-X,
primary128236,Profile of Census Divisions and Subdivisions in Ontario - Part A (Area Profile Series: Data Products: 1991 Census of Population),cens_tbtp95-337-x_12,Discontinued/Not available,,95-337-X,
primary124397,Family Income in Canada (Focus on Canada Series: Analytical Products: 1991 Census of Population),cens_tbtp96-318-x_12,Discontinued/Not available,,96-318-X,
primary125235,Population Estimates by First Official Language Spoken (Dimensions Series: Data Products: 1991 Census of Population),cens_tbtp94-320-x_12,Discontinued/Not available,,94-320-X,
primary123071,The labour force participation of immigrants,article11-008-x19860022441_12,,Do not load to OLC,11-008-X19860022441,
primary123285,Reading skills of the immigrant population,article11-008-x19920021274_12,,Do not load to OLC,11-008-X19920021274,
primary123173,Canada's immigrant population,article11-008-x19890021202_12,,Do not load to OLC,11-008-X19890021202,
primary123304,Canada's immigrants: Recent trends,article11-008-x19930011283_12,,Do not load to OLC,11-008-X19930011283,
primary123237,Immigration during the 1980s,article11-008-x19900041265_12,,Do not load to OLC,11-008-X19900041265,
primary123067,Immigration,article11-008-x19860022437_12,,Do not load to OLC,11-008-X19860022437,
primary125418,Population and Dwelling Counts - Place Name Lists - Quebec and Ontario  (Data Products: Population and Dwelling Counts: 1991 Census of Population),cens_tbtp93-308-x_12,Discontinued/Not available,,93-308-X,
primary126240,Population and Dwelling Counts - Unincorporated Places (Data Products: Population and Dwelling Counts: 1991 Census of Population),cens_tbtp93-306-x_12,Discontinued/Not available,,93-306-X,
primary126338,Quebec. Part 1,cens_tbtp94-109-x_12,Discontinued/Not available,,94-109-X,
primary126341,Quebec. Part 2,cens_tbtp94-110-x_12,Discontinued/Not available,,94-110-X,
primary130007,Labour Force Activity (Data Products: Nation Series: 1991 Census of Population),cens_tbtp93-324-x_12,Discontinued/Not available,,93-324-X,
primary129989,Occupied Private Dwellings (Data Products: Nation Series: 1991 Census of Population),cens_tbtp93-314-x_12,Discontinued/Not available,,93-314-X,
primary129991,Ethnic Origin (Data Products: Nation Series: 1991 Census of Population),cens_tbtp93-315-x_12,Discontinued/Not available,,93-315-X,
primary129121,Population and Dwelling Counts - Census Divisions and Census Subdivisions (Data Products: Population and Dwelling Counts: 1991 Census of Population),cens_tbtp93-304-x_12,Discontinued/Not available,,93-304-X,
primary128268,"Profile of Census Tracts in Kingston, Oshawa and Peterborough - Part B  (Area Profile Series: Data Products: 1991 Census of Population)",cens_tbtp95-345-x_12,Discontinued/Not available,,95-345-X,
primary128264,"Profile of Census Tracts in Kingston, Oshawa and Peterborough - Part A (Area Profile Series: Data Products: 1991 Census of Population)",cens_tbtp95-344-x_12,Discontinued/Not available,,95-344-X,
primary128255,Profile of Census Tracts in Hamilton - Part A (Area Profile Series: Data Products: 1991 Census of Population),cens_tbtp95-341-x_12,Discontinued/Not available,,95-341-X,
primary128213,"Profile of Census Tracts in Chicoutimi - Jonquière, Sherbrooke and Trois-Rivières - Part B  (Area Profile Series: Data Products: 1991 Census of Population)",cens_tbtp95-328-x_12,Discontinued/Not available,,95-328-X,
primary127938,Profile of Census Tracts in Moncton and Saint John - Part B  (Area Profile Series: Data Products: 1991 Census of Population),cens_tbtp95-322-x_12,Discontinued/Not available,,95-322-X,
primary123327,Canada's refugee flows: Gender inequality,article11-008-x19930041420_12,,Do not load to OLC,11-008-X19930041420,
primary123175,Program choices of foreign university students,article11-008-x19890021204_12,,Do not load to OLC,11-008-X19890021204,
primary123390,International students in Canada,article11-008-x19960012572_12,,Do not load to OLC,11-008-X19960012572,
primary129993,Immigration and Citizenship (Data Products: Nation Series: 1991 Census of Population),cens_tbtp93-316-x_12,Discontinued/Not available,,93-316-X,
primary123379,The Chinese in Canada,article11-008-x19950032479_12,,Do not load to OLC,11-008-X19950032479,
primary123352,A history of emigration from Canada,article11-008-x19940031418_12,,Do not load to OLC,11-008-X19940031418,
primary127739,Canada's Melting Pot,article87-003-x19900042136_12,,Do not load to OLC,87-003-X19900042136,
primary127752,Immigration and international VFR travel,article87-003-x19910022150_12,,Do not load to OLC,87-003-X19910022150,
primary126694,Knowledge of Languages (Data Products: Nation Series: 1991 Census of Population),cens_tbtp93-318-x_12,Discontinued/Not available,,93-318-X,
primary126369,Language Retention and Transfer (Dimensions Series: Data Products: 1991 Census of Population),cens_tbtp94-319-x_12,Discontinued/Not available,,94-319-X,
primary128263,Public Libraries,publication87-205-x_12,Discontinued/Not available,Do not load to OLC,87-205-X,
primary128318,Agricultural Profile of Ontario - Part 2 (Data Products: 1991 Census of Agriculture),cens_tbtp95-357-x_12,Discontinued/Not available,,95-357-X,
primary129987,Mother Tongue (Data Products: Nation Series: 1991 Census of Population),cens_tbtp93-313-x_12,Discontinued/Not available,,93-313-X,
primary128292,Profile of Census Tracts in Ottawa - Hull - Part A (Area Profile Series: Data Products: 1991 Census of Population),cens_tbtp95-350-x_12,Discontinued/Not available,,95-350-X,
primary128869,Population and Dwelling Counts - Federal Electoral Districts (Data Products: Population and Dwelling Counts: 1991 Census of Population),cens_tbtp93-302-x_12,Discontinued/Not available,,93-302-X,
primary129087,"Visible Minorities - Employment Equity Fact Sheets, 1986 Census",cens_tbtp89f0026x_12,Discontinued/Not available,,89F0026X,
primary128251,"Profile of Census Tracts in Brantford, Guelph, Kitchener and St. Catharines -  Niagara - Part B  (Area Profile Series: Data Products: 1991 Census of Population)",cens_tbtp95-340-x_12,Discontinued/Not available,,95-340-X,
primary128245,"Profile of Census Tracts in Brantford, Guelph, Kitchener and St. Catharines - Niagara - Part A (Area Profile Series: Data Products: 1991 Census of Population)",cens_tbtp95-339-x_12,Discontinued/Not available,,95-339-X,
primary127255,Profile of Census Divisions and Subdivisions in Northwest Territories - Part A (Area Profile Series: Data Products: 1991 Census of Population),cens_tbtp95-397-x_12,Discontinued/Not available,,95-397-X,
primary127417,Profile of Census Divisions and Subdivisions in Northwest Territories - Part B (Area Profile Series: Data Products: 1991 Census of Population),cens_tbtp95-398-x_12,Discontinued/Not available,,95-398-X,
primary128220,Profile of Census Tracts in Montréal - Part B  (Area Profile Series: Data Products: 1991 Census of Population),cens_tbtp95-330-x_12,Discontinued/Not available,,95-330-X,
primary128222,Profile of Census Tracts in Québec - Part A (Area Profile Series: Data Products: 1991 Census of Population),cens_tbtp95-332-x_12,Discontinued/Not available,,95-332-X,
primary128217,Profile of Census Tracts in Montréal - Part A (Area Profile Series: Data Products: 1991 Census of Population),cens_tbtp95-329-x_12,Discontinued/Not available,,95-329-X,
primary127457,Profile of Census Divisions and Subdivisions in Saskatchewan - Part A (Area Profile Series: Data Products: 1991 Census of Population),cens_tbtp95-365-x_12,Discontinued/Not available,,95-365-X,
primary128902,Canadian suicide mortality rates: First-generation immigrants versus Canadian-born,article82-003-s19900041979_12,,Do not load to OLC,82-003-S19900041979,
primary123060,Foreign students,article11-008-x19860011314_12,,Do not load to OLC,11-008-X19860011314,
primary123351,Allophone immigrants: Language choices in the home,article11-008-x19940031417_12,,Do not load to OLC,11-008-X19940031417,
primary123364,Immigrants in Quebec,article11-008-x19950012355_12,,Do not load to OLC,11-008-X19950012355,
primary123328,Temporary residents of Canada,article11-008-x19930041421_12,,Do not load to OLC,11-008-X19930041421,
primary123266,Canada's immigrant children,article11-008-x19910041393_12,,Do not load to OLC,11-008-X19910041393,
primary125427,Dwellings and Households (Data Products: Nation Series: 1991 Census of Population),cens_tbtp93-311-x_12,Discontinued/Not available,,93-311-X,
primary125419,Population and Dwelling Counts - Place Name Lists - Western Provinces and the Territories (Data Products: Population and Dwelling Counts: 1991 Census of Population),cens_tbtp93-309-x_12,Discontinued/Not available,,93-309-X,
primary128598,Correctional services in Canada: Highlights for 1993-94,article85-002-x19950058209_12,,Do not load to OLC,85-002-X19950058209,
primary128541,"Risk of personal and household victimization: Canada, 1993",article85-002-x19950028206_12,,Do not load to OLC,85-002-X19950028206,
primary128071,"Culture Statistics, Public Libraries in Canada",publication87-514-x_12,Discontinued/Not available,Do not load to OLC,87-514-X,
primary127110,Adult community corrections in Canada: 1994-95,article85-002-x19960088222_12,,Do not load to OLC,85-002-X19960088222,
primary126565,"Decisions and dispositions in youth court, 1986/87 to 1989/90",article85-002-x19900198243_12,,Do not load to OLC,85-002-X19900198243,
primary122874,The changing workload in youth courts,article85-002-x19910108236_12,,Do not load to OLC,85-002-X19910108236,
primary127003,Youth court statistics 1991-92 highlights,article85-002-x19920168269_12,,Do not load to OLC,85-002-X19920168269,
primary131910,Court services in Canada,article85-002-x19910038235_12,,Do not load to OLC,85-002-X19910038235,
primary122361,StatCan: CANSIM Disc - User's Guide,issue10f0007g1996001_12,Completed,Do not load to OLC,10F0007G1996001,
primary123790,Can I help you?: household spending on services,article11-010-x19980114067_12,,Do not load to OLC,11-010-X19980114067,
primary123832,Income inequality in North America: does the 49th parallel still matter?,article11-010-x20000085131_12,,Do not load to OLC,11-010-X20000085131,
primary123637,"The value of household work in Canada, 1986",article11-010-x19920061558_12,,Do not load to OLC,11-010-X19920061558,
primary131743,"What is """"sustainable"""" agriculture?",article96-325-x20010006947_12,,Do not load to OLC,96-325-X20010006947,
primary131764,So you want to try farming? Here's what it costs,article96-325-x20010006971_12,,Do not load to OLC,96-325-X20010006971,
primary131741,Bud the Spud moves west,article96-325-x20010006943_12,,Do not load to OLC,96-325-X20010006943,
primary131742,From Concord to Chardonnay: Canada's grape transformation,article96-325-x20010006944_12,,Do not load to OLC,96-325-X20010006944,
primary131739,Grain elevators getting bigger but fewer,article96-325-x20010006941_12,,Do not load to OLC,96-325-X20010006941,
primary131751,There's a pig in your closet,article96-325-x20010006955_12,,Do not load to OLC,96-325-X20010006955,
primary131754,Farming with a mouse,article96-325-x20010006958_12,,Do not load to OLC,96-325-X20010006958,
primary124132,Unpaid and paid overtime: incidence and duration,article71-005-x19970024131_12,,Do not load to OLC,71-005-X19970024131,
primary124144,Employment,article71-005-x19980015152_12,,Do not load to OLC,71-005-X19980015152,
primary124161,A profile of the unemployed,article71-005-x19990035139_12,,Do not load to OLC,71-005-X19990035139,
primary124140,Introduction: major trends (labour force update),article71-005-x19970034613_12,,Do not load to OLC,71-005-X19970034613,
primary124145,Introduction (Labour force update: An overview of the 1997 labour market),article71-005-x19980015318_12,,Do not load to OLC,71-005-X19980015318,
primary124135,Provincial variations,article71-005-x19970034562_12,,Do not load to OLC,71-005-X19970034562,
primary124131,Voluntary part-time employment,article71-005-x19970024130_12,,Do not load to OLC,71-005-X19970024130,
primary126668,List of Canadian Hospitals,issue83-239-x1992000_12,Completed,Do not load to OLC,83-239-X1992000,
primary126669,List of Canadian Hospitals,issue83-239-x1993000_12,Completed,Do not load to OLC,83-239-X1993000,
primary127687,Who's keeping up with the Jones?,article87-003-x19890012100_12,,Do not load to OLC,87-003-X19890012100,
primary123315,Seniors 75+: Living arrangements and lifestyles - Living arrangements,article11-008-x19930021293_12,,Do not load to OLC,11-008-X19930021293,
primary123316,Seniors 75+: Living arrangements and lifestyles - Lifestyles,article11-008-x19930021294_12,,Do not load to OLC,11-008-X19930021294,
primary127746,The golden years,article87-003-x19910012146_12,,Do not load to OLC,87-003-X19910012146,
primary123841,Plugging in: The increase of household Internet use continues,article11-010-x20010015461_12,,Do not load to OLC,11-010-X20010015461,
primary123423,Everyday technology: Are Canadians using it?,article11-008-x19970023182_12,,Do not load to OLC,11-008-X19970023182,
primary123760,Factors affecting technology adoption: A comparison of Canada and the United States,article11-010-x19970083116_12,,Do not load to OLC,11-010-X19970083116,
primary123689,Innovation: The key to success in small firms,article11-010-x19940081587_12,,Do not load to OLC,11-010-X19940081587,
primary135079,Why hungry factories order robots and chips,article61-223-x19930002591_12,,Do not load to OLC,61-223-X19930002591,
primary124767,Energy consumption,article11-528-x19930013115_12,,Do not load to OLC,11-528-X19930013115,
primary123163,Canadian Social Trends,issue11-008-x1989001_12,Completed,Do not load to OLC,11-008-X1989001,
primary123172,Canadian Social Trends,issue11-008-x1989002_12,Completed,Do not load to OLC,11-008-X1989002,
primary123758,Trading travellers - International travel trends,article11-010-x19970073086_12,,Do not load to OLC,11-010-X19970073086,
primary123772,"Differences in earnings inequality by provinces, 1982-1994",article11-010-x19980023542_12,,Do not load to OLC,11-010-X19980023542,
primary123619,Family income inequality in the 1980s,article11-010-x19910091549_12,,Do not load to OLC,11-010-X19910091549,
primary123683,"Unemployment insurance, temporary layoffs, and recall expectations",article11-010-x19940051585_12,,Do not load to OLC,11-010-X19940051585,
primary123651,"Canada's interprovincial trade flows of goods, 1984-88",article11-010-x19930011569_12,,Do not load to OLC,11-010-X19930011569,
primary123633,Canada's position in world trade,article11-010-x19920041556_12,,Do not load to OLC,11-010-X19920041556,
primary123639,An overview of labour turnover,article11-010-x19920071559_12,,Do not load to OLC,11-010-X19920071559,
primary123603,Recent trends in the automotive industry,article11-010-x19910011541_12,,Do not load to OLC,11-010-X19910011541,
primary123607,Tracking down discretionary income,article11-010-x19910031543_12,,Do not load to OLC,11-010-X19910031543,
primary123767,Trucking in a borderless market - An industry profile,article11-010-x19970113378_12,,Do not load to OLC,11-010-X19970113378,
primary123766,A profile of the self-employed,article11-010-x19970113377_12,,Do not load to OLC,11-010-X19970113377,
primary123812,Supplementary measures of unemployment,article11-010-x19990104719_12,,Do not load to OLC,11-010-X19990104719,
primary123609,Industry output in recessions,article11-010-x19910041544_12,,Do not load to OLC,11-010-X19910041544,
primary131735,What's in your grocery cart?,article96-325-x20010006937_12,,Do not load to OLC,96-325-X20010006937,
primary131761,From wild beast to docile From wild beast to docile partner,article96-325-x20010006967_12,,Do not load to OLC,96-325-X20010006967,
primary131760,Stop the car! Are those llamas in that field?,article96-325-x20010006966_12,,Do not load to OLC,96-325-X20010006966,
primary136161,Prairie farmers have always found a way to adapt,article96-325-x20010006940_12,,Do not load to OLC,96-325-X20010006940,
primary126730,Composition and trends by occupation,article71-005-x19990024569_12,,Do not load to OLC,71-005-X19990024569,
primary124146,Major trends - labour force participation,article71-005-x19980024557_12,,Do not load to OLC,71-005-X19980024557,
primary128813,Underemployment,article71-005-x19970024129_12,,Do not load to OLC,71-005-X19970024129,
primary135086,Supplementary measures of unemployment,article71-005-x19990035142_12,,Do not load to OLC,71-005-X19990035142,
primary126626,The Canadian and US labour markets: a regional perspective,article71-005-x19980044053_12,,Do not load to OLC,71-005-X19980044053,
primary130098,"Stages of processing and economic trends in the manufacturing sector, 1988 - 1996",article31-211-x19960004087_12,,Do not load to OLC,31-211-X19960004087,
primary126683,"Gross Domestic Product by Industry (1992=100), 1961-1992",issue15-512-x1998001_12,Last completed issue,Do not load to OLC,15-512-X1998001,
primary126682,"Gross Domestic Product by Industry (1992=100), 1961-1992",issue15-512-x1985001_12,Completed,Do not load to OLC,15-512-X1985001,
primary123251,Caring for children,article11-008-x19910021371_12,,Do not load to OLC,11-008-X19910021371,
primary123264,Missing children,article11-008-x19910041391_12,,Do not load to OLC,11-008-X19910041391,
primary123061,Child care,article11-008-x19860011315_12,,Do not load to OLC,11-008-X19860011315,
primary124770,Transportation of dangerous goods,article11-528-x19930013123_12,,Do not load to OLC,11-528-X19930013123,
primary124777,Local Government Waste Management Practices Survey,article11-528-x19930013130_12,,Do not load to OLC,11-528-X19930013130,
primary124776,Waste Management Industry Survey,article11-528-x19930013129_12,,Do not load to OLC,11-528-X19930013129,
primary123784,"The cellular telephone industry: birth, revolution and prospects",article11-010-x19980083932_12,,Do not load to OLC,11-010-X19980083932,
primary123410,Canadian television in transition,article11-008-x19960043007_12,,Do not load to OLC,11-008-X19960043007,
primary136515,"Television: Glorious past, uncertain future",article63-016-x19950022588_12,,Do not load to OLC,63-016-X19950022588,
primary127861,Preparing for the information highway,article87-004-x19960012562_12,,Do not load to OLC,87-004-X19960012562,
primary123205,Canadian Social Trends,issue11-008-x1990001_12,Completed,Do not load to OLC,11-008-X1990001,
primary128049,Non-metro is growing,article21-004-x19970093231_12,,Do not load to OLC,21-004-X19970093231,
primary128054,Non-metro is still growing,article21-004-x19980033605_12,,Do not load to OLC,21-004-X19980033605,
primary125701,Addendum: coronary artery bypass surgery in Canada,article82-003-s19900021965_12,,Do not load to OLC,82-003-S19900021965,
primary128024,VISTA on the Agri-food Industry and the Farm Community,issue21-004-x1995001_12,Completed,Do not load to OLC,21-004-X1995001,
primary128055,VISTA on the Agri-food Industry and the Farm Community,issue21-004-x1998009_12,Completed,Do not load to OLC,21-004-X1998009,
primary128041,VISTA on the Agri-food Industry and the Farm Community,issue21-004-x1997003_12,Completed,Do not load to OLC,21-004-X1997003,
primary123716,Recent trends in employer payroll taxes,article11-010-x19950092580_12,,Do not load to OLC,11-010-X19950092580,
primary123873,Foreign affiliate trade statistics: how goods and services are delivered in international markets,article11-010-x20020056184_12,,Do not load to OLC,11-010-X20020056184,
primary123627,Repeat use of the unemployment insurance program,article11-010-x19920011553_12,,Do not load to OLC,11-010-X19920011553,
primary123641,"Characteristics of importing firms, 1978-86",article11-010-x19920081560_12,,Do not load to OLC,11-010-X19920081560,
primary133662,Pig production is getting bigger and more specialized,article96-325-x20010006954_12,,Do not load to OLC,96-325-X20010006954,
primary131755,Dairy farming goes high tech,article96-325-x20010006959_12,,Do not load to OLC,96-325-X20010006959,
primary131740,The rise and fall of fall rye,article96-325-x20010006942_12,,Do not load to OLC,96-325-X20010006942,
primary131748,They're here to farm,article96-325-x20010006952_12,,Do not load to OLC,96-325-X20010006952,
primary124479,Who gets Unemployment Insurance?,article72-002-x19940102592_12,,Do not load to OLC,72-002-X19940102592,
primary124483,1994 year end review,article72-002-x19950012594_12,,Do not load to OLC,72-002-X19950012594,
primary124487,Hiring difficulties in manufacturing,article72-002-x19950042595_12,,Do not load to OLC,72-002-X19950042595,
primary127813,"Demographic and Income Statistics for Postal Areas, Ontario",issue17-205-x1988000_12,Completed,Do not load to OLC,17-205-X1988000,
primary122307,The new face of automobile transplants in Canada,article65-001-x199300713036_12,,Do not load to OLC,65-001-X199300713036,
primary122296,Canadian export trade with India,article65-001-x19920095448_12,,Do not load to OLC,65-001-X19920095448,
primary122289,"Canada's role in the international agricultural market, 1981-1989",article65-001-x19920035451_12,,Do not load to OLC,65-001-X19920035451,
primary129824,Salaries and Salary Scales of Full-time Teaching Staff at Canadian Universities,issue81-258-x1991000_12,Completed,Do not load to OLC,81-258-X1991000,
primary125486,Salaries and Salary Scales of Full-time Teaching Staff at Canadian Universities,issue81-258-x1990000_12,Completed,Do not load to OLC,81-258-X1990000,
primary125484,Salaries and Salary Scales of Full-time Teaching Staff at Canadian Universities,issue81-258-x1988000_12,Completed,Do not load to OLC,81-258-X1988000,
