extras_10uid_bi_strs,extras_title_en_txts,extras_pkuniqueidcode_bi_strs,extras_statusf_en_strs,Load to OLC,extras_productidnew_bi_strs,
primary130585,Agricultural Profile of Ontario (Data and Analytical Products: 1996 Census of Agriculture),publication95-177-x_12,Ongoing/Available,Do not load to OLC,95-177-X,
primary130591,Agricultural Profile of Alberta (Data and Analytical Products: 1996 Census of Agriculture),publication95-180-x_12,Ongoing/Available,Do not load to OLC,95-180-X,
primary125314,"Homicide in Canada, a Statistical Perspective",publication85-209-x_12,Discontinued/Not available,Do not load to OLC,85-209-X,
primary123386,Health facts from the 1994 National Population Health Survey,article11-008-x19950042713_12,,Do not load to OLC,11-008-X19950042713,
primary123735,An overview of recent provincial trends,article11-010-x19960072837_12,,Do not load to OLC,11-010-X19960072837,
primary130581,Agricultural Profile of the Atlantic Provinces (Data and Analytical Products: 1996 Census of Agriculture),publication95-175-x_12,Ongoing/Available,Do not load to OLC,95-175-X,
primary134451,Agricultural Profile of Saskatchewan (Data and Analytical Products: 1996 Census of Agriculture),publication95-179-x_12,Ongoing/Available,Do not load to OLC,95-179-X,
primary130583,Agricultural Profile of Quebec (Data and Analytical Products: 1996 Census of Agriculture),publication95-176-x_12,Ongoing/Available,Do not load to OLC,95-176-X,
primary128083,Partial portrait of farm investments in environmental protection,article21-004-x20040036776_12,,Do not load to OLC,21-004-X20040036776,
primary131705,The revolution in tillage,article96-325-x19960014822_12,,Do not load to OLC,96-325-X19960014822,
primary131712,Have American food products invaded the Canadian market?,article96-325-x19960014829_12,,Do not load to OLC,96-325-X19960014829,
primary131707,Irrigation: Western Canada's liquid asset,article96-325-x19960014824_12,,Do not load to OLC,96-325-X19960014824,
primary131719,Turning numbers into action,article96-325-x19960014836_12,,Do not load to OLC,96-325-X19960014836,
primary123424,Stalking: Criminal harassment in Canada,article11-008-x19970023184_12,,Do not load to OLC,11-008-X19970023184,
primary123087,Lifestyle risks: Smoking and drinking in Canada,article11-008-x19860041344_12,,Do not load to OLC,11-008-X19860041344,
primary129047,Livestock Report,publication23-008-x_12,Discontinued/Not available,Do not load to OLC,23-008-X,
primary129199,Livestock and Animal Products Statistics,publication23-203-x_12,Discontinued/Not available,Do not load to OLC,23-203-X,
primary133663,The North American beef market: competition keeps it lean,article96-325-x19960014814_12,,Do not load to OLC,96-325-X19960014814,
primary131700,Organic farming: the trend is growing,article96-325-x19960014817_12,,Do not load to OLC,96-325-X19960014817,
primary135154,Canada's Men,publication71-206-x_12,Discontinued/Not available,Do not load to OLC,71-206-X,
primary123714,Purchasing power parities,article11-010-x19950082582_12,,Do not load to OLC,11-010-X19950082582,
primary130108,Domestic Foreign Control MFG Estimate,publication31-401-x_12,Discontinued/Not available,Do not load to OLC,31-401-X,
primary128812,"Schooling, Work and Related Activities, Income, Expenses and Mobility",publication89-534-x_12,Discontinued/Not available,Do not load to OLC,89-534-X,
primary135364,Profile of the Aboriginal Population Residing in Selected Off Reserve Areas. Volume I,publication96f0024x_12,Discontinued/Not available,Do not load to OLC,96F0024X,
primary133758,Profile of the Aboriginal Population Residing in Selected Off Reserve Areas. Volume II,publication96f0025x_12,Discontinued/Not available,Do not load to OLC,96F0025X,
primary133752,Canada's Aboriginal Population by Census Subdivisions from the 1986 Census,publication96f0002x_12,Discontinued/Not available,Do not load to OLC,96F0002X,
primary130769,Agricultural Profile of New Brunswick - Part 2 (Data Products: 1991 Census of Agriculture),publication95-324-x_12,Discontinued/Not available,Do not load to OLC,95-324-X,
primary130757,Agricultural Profile of Nova Scotia - Part 2 (Data Products: 1991 Census of Agriculture),publication95-318-x_12,Discontinued/Not available,Do not load to OLC,95-318-X,
primary132977,Trends and Highlights of Canadian Agriculture and Its People: 1991 Census of Agriculture (Analytical Products: 1991 Census of Agriculture),publication96-303-x_12,Discontinued/Not available,Do not load to OLC,96-303-X,
primary128817,Family Violence in Canada: A Statistical Profile,publication89-541-x_12,Ongoing/Available,Do not load to OLC,89-541-X,
primary126652,Nursing in Canada [1988],publication83-226-x_12,Discontinued/Not available,Do not load to OLC,83-226-X,
primary136623,Nursing in Canada: Registered Nurses,publication83-243-x_12,Discontinued/Not available,Do not load to OLC,83-243-X,
primary125465,Teachers in Universities,publication81-241-x_12,Discontinued/Not available,Do not load to OLC,81-241-X,
primary129800,Educational Staff of Community Colleges and Vocational Schools,publication81-254-x_12,Discontinued/Not available,Do not load to OLC,81-254-X,
primary125483,Salaries and Salary Scales of Full-time Teaching Staff at Canadian Universities,publication81-258-x_12,Discontinued/Not available,Do not load to OLC,81-258-X,
primary128852,Education Statistics Bulletin,publication81-002-x_12,Discontinued/Not available,Do not load to OLC,81-002-X,
primary125475,Salaries and Salary Scales of Full-time Teaching Staff at Canadian Universities,publication81-258-p_12,Discontinued/Not available,Do not load to OLC,81-258-P,
primary125479,Salaries and Salary Scales of Full-time Teaching Staff at Canadian Universities,publication81-258-s_12,Discontinued/Not available,Do not load to OLC,81-258-S,
primary124109,Human Activity and the Environment [2000],publication11-509-x_12,Discontinued/Not available,Do not load to OLC,11-509-X,
primary124582,Provincial and Territorial Government Employment,publication72-007-x_12,Discontinued/Not available,Do not load to OLC,72-007-X,
primary135844,Family Expenditure in Canada,publication62-555-x_12,Discontinued/Not available,Do not load to OLC,62-555-X,
primary135894,Dwelling Characteristics and Household Equipment by Income Quintile for Canada,publication62f0042x_12,Discontinued/Not available,Do not load to OLC,62F0042X,
primary135899,Dwelling Characteristics and Household Equipment by Housing Tenure for Canada,publication62f0043x_12,Discontinued/Not available,Do not load to OLC,62F0043X,
primary135903,Dwelling Characteristics and Household Equipment by Household Type for Canada,publication62f0044x_12,Discontinued/Not available,Do not load to OLC,62F0044X,
primary135861,Family Expenditures Survey 1992 (FAMEX) Standard Detailed Tables,publication62f0009x_12,Discontinued/Not available,Do not load to OLC,62F0009X,
primary131019,Apparent Per Capita Food Consumption in Canada: Reference Manual for Catalogue 32-229 and 32-230,publication32-509-x_12,Discontinued/Not available,Do not load to OLC,32-509-X,
primary125575,Index to Statistics Canada Surveys and Questionnaires,publication12f0046x_12,Discontinued/Not available,Do not load to OLC,12F0046X,
primary126695,Nursing Education Programs,publication83-244-x_12,Discontinued/Not available,Do not load to OLC,83-244-X,
primary126167,Household Facilities by Income and Other Characteristics,publication13-218-x_12,Discontinued/Not available,Do not load to OLC,13-218-X,
primary126197,"The Distribution of Wealth in Canada, 1984",publication13-580-x_12,Discontinued/Not available,Do not load to OLC,13-580-X,
primary126209,"Low Income Family Units, 1980 to 1992 (LICO 1992 Base)",publication13-591-x_12,Discontinued/Not available,Do not load to OLC,13-591-X,
primary128566,Directory of Federal Government Scientific & Technological Establishments,publication88-206-x_12,Discontinued/Not available,Do not load to OLC,88-206-X,
primary122141,Income of Immigrants in Canada: A Census Data Analysis,publication91-527-x_12,Discontinued/Not available,Do not load to OLC,91-527-X,
primary129833,International Student Participation in Canadian Education 1993 to 1995,publication81-261-x_12,Discontinued/Not available,Do not load to OLC,81-261-X,
primary135879,Detailed Average Household Expenditure by Housing Tenure for Canada,publication62f0033x_12,Discontinued/Not available,Do not load to OLC,62F0033X,
primary135875,Detailed Average Household Expenditure by Household Income Quintile for Canada and Provinces,publication62f0032x_12,Discontinued/Not available,Do not load to OLC,62F0032X,
primary135870,Detailed Average Household Expenditure for Canada and Provinces,publication62f0031x_12,Discontinued/Not available,Do not load to OLC,62F0031X,
primary135887,Detailed Average Household Expenditure by Size of Area of Residence for Canada,publication62f0035x_12,Discontinued/Not available,Do not load to OLC,62F0035X,
primary135882,Detailed Average Household Expenditure by Household Type for Canada,publication62f0034x_12,Discontinued/Not available,Do not load to OLC,62F0034X,
primary127874,Developing a Longitudinal Database on Businesses in the Canadian Economy: An Approach to the Study of Employment,publication18-501-x_12,Discontinued/Not available,Do not load to OLC,18-501-X,
primary124801,Databases for Environmental Analysis: Provincial and Territorial Governments,publication11-529-x_12,Discontinued/Not available,Do not load to OLC,11-529-X,
primary133232,The Self-employed (Focus on Canada Series: Analytical Products: 1991 Census of Population),publication96-316-x_12,Discontinued/Not available,Do not load to OLC,96-316-X,
primary135405,Enterprising Canadians: The Self-employed in Canada,publication71-536-x_12,Discontinued/Not available,Do not load to OLC,71-536-X,
primary128904,Self-employment in Canada,publication71-582-x_12,Discontinued/Not available,Do not load to OLC,71-582-X,
primary136566,Motion Picture Theatres and Film Distributors,publication63-207-x_12,Discontinued/Not available,Do not load to OLC,63-207-X,
primary134446,Cellular telephone 1996,article56-001-x19970045197_12,,Do not load to OLC,56-001-X19970045197,
primary134436,"Cellular telephone, 1995",article56-001-x19960035202_12,,Do not load to OLC,56-001-X19960035202,
primary134430,Cellular telephone,article56-001-x19950045206_12,,Do not load to OLC,56-001-X19950045206,
primary128606,Arts and Culture: A Statistical Profile,publication87-527-x_12,Discontinued/Not available,Do not load to OLC,87-527-X,
primary134432,"Cable television statistics, 1995",article56-001-x19960015205_12,,Do not load to OLC,56-001-X19960015205,
primary134426,"Cable television statistics, 1994",article56-001-x19950025208_12,,Do not load to OLC,56-001-X19950025208,
primary134442,"Cable television statistics, 1996",article56-001-x19970025199_12,,Do not load to OLC,56-001-X19970025199,
primary127881,Highlights of the 1994-95 data on book publishers and exclusive agents,article87-004-x19970023215_12,,Do not load to OLC,87-004-X19970023215,
primary124220,LandData BC: Past and future tense,article11-522-x19950013264_12,,Do not load to OLC,11-522-X19950013264,
primary123278,Periodical publishing in Canada,article11-008-x19920011389_12,,Do not load to OLC,11-008-X19920011389,
primary134424,"Radio and television statistics, 1994",article56-001-x19950015209_12,,Do not load to OLC,56-001-X19950015209,
primary134434,"Radio and television statistics, 1995",article56-001-x19960025204_12,,Do not load to OLC,56-001-X19960025204,
primary134440,"Radio and television statistics, 1996",article56-001-x19970015200_12,,Do not load to OLC,56-001-X19970015200,
primary124221,Serving clients better electronically: The StatsCan online project,article11-522-x19950013265_12,,Do not load to OLC,11-522-X19950013265,
primary134438,"Telephone statistics, 1995",article56-001-x19960045201_12,,Do not load to OLC,56-001-X19960045201,
primary134428,"Telephone statistics, 1994",article56-001-x19950035207_12,,Do not load to OLC,56-001-X19950035207,
primary127887,Small Canadian book publishers - How are they different?,article87-004-x19970043482_12,,Do not load to OLC,87-004-X19970043482,
primary134444,"Telephone statistics, 1996",article56-001-x19970035198_12,,Do not load to OLC,56-001-X19970035198,
primary139217,1991 Standard Occupational Classification (SOC) - Classification Structure,publication12f0038x_4,Do not load to OLC,Do not load to OLC,12F0038X,
primary140816,Survey of Volunteer Activity (1987),publication89m0011x_4,Do not load to OLC,Do not load to OLC,89M0011X,
primary139189,Survey on Ageing and Independence (1991),publication91m0002x_4,Do not load to OLC,Do not load to OLC,91M0002X,
primary140814,Survey of Volunteer Workers (1980),publication89m0010x_4,Discontinued/Not available,Do not load to OLC,89M0010X,
primary139297,Post Secondary Student Survey (1984),publication81m0018x_4,Do not load to OLC,Do not load to OLC,81M0018X,
primary139243,"General Social Survey, Cycle 7: Time Use (1992) - Public Use Microdata File",publication12m0007x_4,Ongoing/Available,Do not load to OLC,12M0007X,
primary139290,"Survey of Educational Attainment, Alberta (1985)",publication81m0014x_4,Do not load to OLC,Do not load to OLC,81M0014X,
primary140833,Survey of Displaced Workers (1986),publication75m0004x_4,Do not load to OLC,Do not load to OLC,75M0004X,
primary140592,Canadian Out-of-employment Panel Survey 1995,issue72m0001x1995000_4,Completed,Do not load to OLC,72M0001X1995000,
primary139249,"General Social Survey,  Cycle 10: Family (1995) - Public Use Microdata File",publication12m0010x_4,Ongoing/Available,Do not load to OLC,12M0010X,
primary139241,"General Social Survey, Cycle 6: Health (1991) - Public Use Microdata File",publication12m0006x_4,Ongoing/Available,Do not load to OLC,12M0006X,
primary139781,"Family Units and Net Worth by Net Worth Groups, Canada, Regions and Provinces, 1999",publication13f0041x_4,Discontinued/Not available,Do not load to OLC,13F0041X,
primary139225,Concordance Between the Canadian Customs Tariff and the 1997 North American Industry Classification System (NAICS),publication12f0091x_4,Discontinued/Not available,Do not load to OLC,12F0091X,
primary140810,Survey on Drinking and Driving (1988),publication89m0005x_4,Do not load to OLC,Do not load to OLC,89M0005X,
primary140557,Final Report of the Task Force on the Use of Statistics Canada Products in Libraries,publication87f0011x_4,Discontinued/Not available,Do not load to OLC,87F0011X,
primary139822,SCF Public Use Microdata File: Income of Individuals Aged 15 Years and Over,issue13m0004x1997000_4,Do not load to OLC,Do not load to OLC,13M0004X1997000,
primary139818,SCF Public Use Microdata File: Income of Economic Family Units,issue13m0002x1997000_4,Do not load to OLC,Do not load to OLC,13M0002X1997000,
primary139320,"Block-face Data File (BFDF), 1996 Census (Geography Products: Attribute Information Products)",publication92f0026x_4,Discontinued/Not available,Do not load to OLC,92F0026X,
primary140400,Post Secondary Student Survey (1984),publication81m0010x_4,Do not load to OLC,Do not load to OLC,81M0010X,
primary139816,SCF Public Use Microdata File: Income of Census Family Units,publication13m0001x_4,Ongoing/Available,Do not load to OLC,13M0001X,
primary140803,Survey of Child Care (1980),publication89m0002x_4,Ongoing/Available,Do not load to OLC,89M0002X,
primary140801,Survey of Leisure Time Activities (Reading Habits 1978),publication89m0001x_4,Do not load to OLC,Do not load to OLC,89M0001X,
primary139203,Standard Classification of Goods (SCG) - Diskette Version,publication12f0022x_4,Discontinued/Not available,Do not load to OLC,12F0022X,
primary139207,Concordances Between the 1988 Standard Classification of Goods (SCG) (Import Classes Only) and the Various Versions of the Canadian Customs Tariff (CT) From 1988 to 1994  (Codes Only),publication12f0027x_4,Discontinued/Not available,Do not load to OLC,12F0027X,
primary139209,Concordance Between the 1980 and 1991 Editions of the Standard Occupational Classification (SOC),publication12f0028x_4,Discontinued/Not available,Do not load to OLC,12F0028X,
primary139211,Concordances Between the 1980 Standard Occupational Classification (SOC) and the National Occupational Classification (NOC),publication12f0029x_4,Discontinued/Not available,Do not load to OLC,12F0029X,
primary139197,Concordances Between the 1980 Standard Industrial Classification for Establishments (SIC-E) and the 1980 Standard Industrial Classification for Companies and Enterprises (SIC-C),publication12f0016x_4,Discontinued/Not available,Do not load to OLC,12F0016X,
primary139221,1980 Standard Industrial Classification for Companies and Enterprises (SIC-C) - Structure,publication12f0056x_4,Discontinued/Not available,Do not load to OLC,12F0056X,
primary139219,1991 Standard Occupational Classification (SOC) - Structure and Alphabetical Listing of Occupations,publication12f0039x_4,Discontinued/Not available,Do not load to OLC,12F0039X,
primary140138,National DU and DF Matrices,publication15f0001x_4,Do not load to OLC,Do not load to OLC,15F0001X,
primary139199,Standard Industrial Classification (SIC-E) Coding Manual,publication12f0017x_4,Discontinued/Not available,Do not load to OLC,12F0017X,
primary139201,1980 Standard Industrial Classification (SIC-E) - Classification Structure,publication12f0021x_4,Discontinued/Not available,Do not load to OLC,12F0021X,
primary140450,1991 Census Tabulation Guide (Reference Products: General Reference: 1991 Census of Population),publication92-304-x_4,Discontinued/Not available,Do not load to OLC,92-304-X,
primary139901,Data Products: Area Profiles: 1996 Census of Population,cens_tbtp95f0180x_4,Discontinued/Not available,Do not load to OLC,95F0180X,
primary139409,"Street Network and Feature Extension File, Windsor, 1996 Census (Geography Products: Spatial Information Products)",publication92f0124x_4,Ongoing/Available,Do not load to OLC,92F0124X,
primary139407,"Street Network and Feature Extension File, Toronto, 1996 Census (Geography Products: Spatial Information Products)",publication92f0123x_4,Ongoing/Available,Do not load to OLC,92F0123X,
primary139411,"Street Network and Feature Extension File, Winnipeg, 1996 Census (Geography Products: Spatial Information Products)",publication92f0125x_4,Ongoing/Available,Do not load to OLC,92F0125X,
primary139369,"Street Network and Feature Extension Files, Canada, 1996 Census (Geography Products: Spatial Information Products)",publication92f0100x_4,Ongoing/Available,Do not load to OLC,92F0100X,
primary139363,"Forward Sortation Areas Digital Cartographic File, 1996 Census (Geography Products: Spatial Information Products)",publication92f0039x_4,Ongoing/Available,Do not load to OLC,92F0039X,
primary139361,"Designated Places Digital Boundary File/Digital Cartographic File, 1996 Census (Geography Products: Spatial Information Products)",publication92f0038x_4,Ongoing/Available,Do not load to OLC,92F0038X,
primary140312,Data Products: Basic Summary Tabulations: 1996 Census of Population,cens_tbtp95f0269x_4,Discontinued/Not available,Do not load to OLC,95F0269X,
primary140739,"Street Network and Feature Extension File, Kelowna, 1996 Census (Geography Products: Spatial Information Products)",publication92f0135x_4,Ongoing/Available,Do not load to OLC,92F0135X,
primary139399,"Street Network and Feature Extension File, Ottawa - Hull, Recensement De 1996 (Geography Products : Spatial Information Products)",publication92f0119x_4,Ongoing/Available,Do not load to OLC,92F0119X,
primary139405,"Street Network and Feature Extension File, Thunder Bay, 1996 Census (Geography Products: Spatial Information Products)",publication92f0122x_4,Ongoing/Available,Do not load to OLC,92F0122X,
primary139401,"Street Network and Feature Extension File, Peterborough, 1996 Census (Geography Products: Spatial Information Products)",publication92f0120x_4,Ongoing/Available,Do not load to OLC,92F0120X,
primary139403,"Street Network and Feature Extension File, Sudbury, 1996 Census (Geography Products: Spatial Information Products)",publication92f0121x_4,Ongoing/Available,Do not load to OLC,92F0121X,
primary139359,"Urban Areas Digital Boundary File/Digital Cartographic File, 1996 Census (Geography Products: Spatial Information Products)",publication92f0037x_4,Ongoing/Available,Do not load to OLC,92F0037X,
primary139353,"Census Subdivisions Digital Boundary File/Digital Cartographic File, 1996 Census (Geography Products: Spatial Information Products)",publication92f0034x_4,Ongoing/Available,Do not load to OLC,92F0034X,
primary139414,"Street Network and Feature Extension File, Regina, 1996 Census (Geography Products: Spatial Information Products)",publication92f0127x_4,Ongoing/Available,Do not load to OLC,92F0127X,
primary139417,"Street Network and Feature Extension File, Alberta, 1996 Census (Geography Products: Spatial Information Products)",publication92f0129x_4,Ongoing/Available,Do not load to OLC,92F0129X,
primary139413,"Street Network and Feature Extension Files, Saskatchewan, 1996 Census (Geography Products: Spatial Information Products)",publication92f0126x_4,Ongoing/Available,Do not load to OLC,92F0126X,
primary139371,"Street Network and Feature Extension File, St. John's, 1996 Census (Geography Products: Spatial Information Products)",publication92f0101x_4,Ongoing/Available,Do not load to OLC,92F0101X,
primary139373,"Street Network and Feature Extension File, Halifax, 1996 Census (Geography Products: Spatial Information Products)",publication92f0102x_4,Ongoing/Available,Do not load to OLC,92F0102X,
primary139331,"Postal Codes by Federal Ridings (1996 Representation Order) File (PCFRF) - Update, 2001 Census (Geography Products: Attribute Information Products)",publication92f0028u_4,Discontinued/Not available,Do not load to OLC,92F0028U,
primary139336,"Postal Codes by Federal Ridings (1996 Representation Order) File (PCFRF), 1996 Census (Geography Products: Attribute Information Products)",publication92f0028x_4,Ongoing/Available,Do not load to OLC,92F0028X,
primary139324,"Postal Code Conversion File (PCCF), 1996 Census (Geography Products: Attribute Information Products)",publication92f0027x_4,Ongoing/Available,Do not load to OLC,92F0027X,
primary140571,"Street Network and Feature Extension File, Saskatoon, 1996 Census (Geography Products: Spatial Information Products)",publication92f0128x_4,Ongoing/Available,Do not load to OLC,92F0128X,
primary139427,"Street Network and Feature Extension File, Nanaimo, 1996 Census (Geography Products: Spatial Information Products)",publication92f0136x_4,Ongoing/Available,Do not load to OLC,92F0136X,
primary139493,"Street Network and Feature Extension File, Kamloops, 1996 Census (Geography Products: Spatial Information Products)",publication92f0134x_4,Ongoing/Available,Do not load to OLC,92F0134X,
primary140694,"Census Divisions Digital Boundary File/Digital Cartographic File, 1996 Census (Geography Products: Spatial Information Products)",publication92f0032x_4,Ongoing/Available,Do not load to OLC,92F0032X,
primary139380,"Street Network and Feature Extension Files, Province of Quebec, 1996 Census (Geography Products: Spatial Information Products)",publication92f0107x_4,Ongoing/Available,Do not load to OLC,92F0107X,
primary139383,"Street Network and Feature Extension File, Montréal, 1996 Census (Geography Products: Spatial Information Products)",publication92f0109x_4,Ongoing/Available,Do not load to OLC,92F0109X,
primary140702,"Census Tracts Digital Boundary File/Digital Cartographic File, 1996 Census (Geography Products: Spatial Information Products)",publication92f0036x_4,Ongoing/Available,Do not load to OLC,92F0036X,
primary140700,"Census Metropolitan Areas/Census Agglomerations Digital Boundary File/Digital Cartographic File, 1996 Census (Geography Products: Spatial Information Products)",publication92f0035x_4,Ongoing/Available,Do not load to OLC,92F0035X,
primary140710,"Enumeration Areas Digital Boundary File/Digital Cartographic File, 1996 Census (Geography Products: Spatial Information Products)",publication92f0040x_4,Ongoing/Available,Do not load to OLC,92F0040X,
primary139389,"Street Network and Feature Extension File, Trois-Rivières, 1996 Census (Geography Products: Spatial Information Products)",publication92f0113x_4,Ongoing/Available,Do not load to OLC,92F0113X,
primary139394,"Street Network and Feature Extension File, Belleville, 1996 Census (Geography Products : Spatial Information Products)",publication92f0116x_4,Ongoing/Available,Do not load to OLC,92F0116X,
primary139392,"Street Network and Feature Extension File, Barrie, 1996 Census (Geography Products: Spatial Information Products)",publication92f0115x_4,Ongoing/Available,Do not load to OLC,92F0115X,
primary139396,"Street Network and Feature Extension File, Kingston, 1996 Census (Geography Products : Spatial Information Products)",publication92f0117x_4,Ongoing/Available,Do not load to OLC,92F0117X,
primary139345,Federal Electoral Districts (1987 Representation Order) Digital Boundary File/Digital Cartographic File (Geography Products: Spatial Information Products),publication92f0030x_4,Ongoing/Available,Do not load to OLC,92F0030X,
primary139343,"Provinces and Territories Digital Boundary File/Digital Cartographic File, 1996 Census (Geography Products: Spatial Information Products)",publication92f0029x_4,Ongoing/Available,Do not load to OLC,92F0029X,
primary140716,"Street Network and Feature Extension File, Chicoutimi - Jonquière, 1996 Census (Geography Products: Spatial Information Products)",publication92f0108x_4,Ongoing/Available,Do not load to OLC,92F0108X,
primary140721,"Street Network and Feature Extension File, North Bay, 1996 Census (Geography Products : Spatial Information Products)",publication92f0118x_4,Ongoing/Available,Do not load to OLC,92F0118X,
